{
  "targets_version": "1.0.0",
  "count_targets": [
    {
      "id": "en-cases",
      "description": "EN cases in total",
      "where": {
        "language": "en"
      },
      "min": 200
    },
    {
      "id": "ko-cases",
      "description": "KO cases in total",
      "where": {
        "language": "ko"
      },
      "min": 200
    },
    {
      "id": "en-uncommon-name",
      "description": "EN cases whose focus name is rare or novel",
      "where": {
        "language": "en",
        "name_commonness": "uncommon"
      },
      "min": 100
    },
    {
      "id": "en-common-name",
      "description": "EN cases whose focus name is common",
      "where": {
        "language": "en",
        "name_commonness": "common"
      },
      "min": 100
    },
    {
      "id": "en-ambiguous",
      "description": "EN cases that are context-resolvable or genuinely ambiguous",
      "where": {
        "language": "en",
        "ambiguity": "ambiguous"
      },
      "min": 80
    },
    {
      "id": "ko-uncommon-name",
      "description": "KO cases whose focus name is rare or novel",
      "where": {
        "language": "ko",
        "name_commonness": "uncommon"
      },
      "min": 90
    },
    {
      "id": "ko-common-name",
      "description": "KO cases whose focus name is common",
      "where": {
        "language": "ko",
        "name_commonness": "common"
      },
      "min": 100
    },
    {
      "id": "ko-ambiguous",
      "description": "KO cases that are context-resolvable or genuinely ambiguous",
      "where": {
        "language": "ko",
        "ambiguity": "ambiguous"
      },
      "min": 80
    },
    {
      "id": "en-genuinely-ambiguous",
      "description": "EN honest-ambiguity cases (either)",
      "where": {
        "language": "en",
        "ambiguity_level": "genuinely-ambiguous"
      },
      "min": 12
    },
    {
      "id": "ko-genuinely-ambiguous",
      "description": "KO honest-ambiguity cases (either)",
      "where": {
        "language": "ko",
        "ambiguity_level": "genuinely-ambiguous"
      },
      "min": 10
    },
    {
      "id": "en-single-token",
      "description": "EN cases with a single-token focus span",
      "where": {
        "language": "en",
        "token_class": "single"
      },
      "min": 80
    },
    {
      "id": "en-multi-token",
      "description": "EN cases with a multi-token focus span",
      "where": {
        "language": "en",
        "token_class": "multi"
      },
      "min": 80
    },
    {
      "id": "ko-single-token",
      "description": "KO cases with a single-token focus span",
      "where": {
        "language": "ko",
        "token_class": "single"
      },
      "min": 80
    },
    {
      "id": "ko-multi-token",
      "description": "KO cases with a multi-token focus span",
      "where": {
        "language": "ko",
        "token_class": "multi"
      },
      "min": 40
    },
    {
      "id": "en-collision-common-word",
      "description": "EN cases with a common-word collision",
      "where": {
        "language": "en",
        "collision_classes": "common-word"
      },
      "min": 40
    },
    {
      "id": "ko-collision-common-word",
      "description": "KO cases with a common-word collision",
      "where": {
        "language": "ko",
        "collision_classes": "common-word"
      },
      "min": 40
    },
    {
      "id": "en-collision-organization",
      "description": "EN cases with an organization collision",
      "where": {
        "language": "en",
        "collision_classes": "organization"
      },
      "min": 30
    },
    {
      "id": "ko-collision-organization",
      "description": "KO cases with an organization collision",
      "where": {
        "language": "ko",
        "collision_classes": "organization"
      },
      "min": 24
    },
    {
      "id": "en-collision-location",
      "description": "EN cases with a location collision",
      "where": {
        "language": "en",
        "collision_classes": "location"
      },
      "min": 40
    },
    {
      "id": "ko-collision-location",
      "description": "KO cases with a location collision",
      "where": {
        "language": "ko",
        "collision_classes": "location"
      },
      "min": 30
    },
    {
      "id": "en-collision-temporal",
      "description": "EN cases with a temporal collision",
      "where": {
        "language": "en",
        "collision_classes": "temporal"
      },
      "min": 10
    },
    {
      "id": "ko-collision-temporal",
      "description": "KO cases with a temporal collision",
      "where": {
        "language": "ko",
        "collision_classes": "temporal"
      },
      "min": 5
    },
    {
      "id": "en-collision-product-brand",
      "description": "EN cases with a product-brand collision",
      "where": {
        "language": "en",
        "collision_classes": "product-brand"
      },
      "min": 14
    },
    {
      "id": "ko-collision-product-brand",
      "description": "KO cases with a product-brand collision",
      "where": {
        "language": "ko",
        "collision_classes": "product-brand"
      },
      "min": 10
    },
    {
      "id": "en-collision-eponym",
      "description": "EN cases with an eponym collision",
      "where": {
        "language": "en",
        "collision_classes": "eponym"
      },
      "min": 6
    },
    {
      "id": "ko-collision-eponym",
      "description": "KO cases with an eponym collision",
      "where": {
        "language": "ko",
        "collision_classes": "eponym"
      },
      "min": 2
    },
    {
      "id": "en-collision-work-title",
      "description": "EN cases with a work-title collision",
      "where": {
        "language": "en",
        "collision_classes": "work-title"
      },
      "min": 4
    },
    {
      "id": "ko-collision-work-title",
      "description": "KO cases with a work-title collision",
      "where": {
        "language": "ko",
        "collision_classes": "work-title"
      },
      "min": 2
    },
    {
      "id": "mixed-script-context",
      "description": "Cases whose sentence mixes scripts",
      "where": {
        "context_types": "mixed-script-sentence"
      },
      "min": 20
    },
    {
      "id": "en-mixed-script-context",
      "description": "EN-profile cases whose sentence mixes scripts",
      "where": {
        "language": "en",
        "context_types": "mixed-script-sentence"
      },
      "min": 5
    },
    {
      "id": "hanja-focus",
      "description": "Cases whose focus span is written in hanja",
      "where": {
        "script": "han"
      },
      "min": 8
    },
    {
      "id": "mixed-script-focus",
      "description": "Cases whose focus span itself mixes scripts",
      "where": {
        "script": "mixed"
      },
      "min": 8
    },
    {
      "id": "en-list-or-structured",
      "description": "EN cases in lists or structured text",
      "where": {
        "language": "en",
        "context_types": [
          "list-or-enumeration",
          "structured-text"
        ]
      },
      "min": 10
    },
    {
      "id": "en-adjacent-names",
      "description": "EN cases with adjacent names",
      "where": {
        "language": "en",
        "boundary_tags": "adjacent-names"
      },
      "min": 6
    },
    {
      "id": "en-title-honorific",
      "description": "EN cases with a title or honorific",
      "where": {
        "language": "en",
        "context_types": "title-honorific"
      },
      "min": 20
    },
    {
      "id": "en-no-person",
      "description": "EN negative cases with no person at all",
      "where": {
        "language": "en",
        "context_types": "no-person"
      },
      "min": 40
    },
    {
      "id": "en-sentence-initial",
      "description": "EN cases with the focus span at sentence start",
      "where": {
        "language": "en",
        "context_types": "sentence-initial"
      },
      "min": 30
    },
    {
      "id": "ko-list-or-structured",
      "description": "KO cases in lists or structured text",
      "where": {
        "language": "ko",
        "context_types": [
          "list-or-enumeration",
          "structured-text"
        ]
      },
      "min": 10
    },
    {
      "id": "ko-adjacent-names",
      "description": "KO cases with adjacent names",
      "where": {
        "language": "ko",
        "boundary_tags": "adjacent-names"
      },
      "min": 6
    },
    {
      "id": "ko-title-honorific",
      "description": "KO cases with a title or honorific",
      "where": {
        "language": "ko",
        "context_types": "title-honorific"
      },
      "min": 20
    },
    {
      "id": "ko-no-person",
      "description": "KO negative cases with no person at all",
      "where": {
        "language": "ko",
        "context_types": "no-person"
      },
      "min": 40
    },
    {
      "id": "ko-sentence-initial",
      "description": "KO cases with the focus span at sentence start",
      "where": {
        "language": "ko",
        "context_types": "sentence-initial"
      },
      "min": 30
    },
    {
      "id": "en-casing-variation",
      "description": "EN cases in lowercase, ALL CAPS or Title Case text",
      "where": {
        "language": "en",
        "context_types": "casing-variation"
      },
      "min": 8
    },
    {
      "id": "en-possessive-or-plural",
      "description": "EN cases with possessive or plural name references",
      "where": {
        "language": "en",
        "context_types": "possessive"
      },
      "min": 8
    },
    {
      "id": "ko-particle-attached",
      "description": "KO cases with a particle attached to the focus span",
      "where": {
        "language": "ko",
        "context_types": "particle-attached"
      },
      "min": 150
    },
    {
      "id": "ko-romanized",
      "description": "KO-profile cases written in romanization",
      "where": {
        "language": "ko",